{
  "schema_version": "1.0",
  "contribution_type": "review_point",
  "title": "外部长度字段参与接收计数前的边界约束",
  "summary": "检查外部可控长度字段是否在影响缓冲区、DMA或状态机前完成合法范围约束。",
  "domain": ["embedded", "protocol"],
  "review_question": "外部输入的长度字段在参与数组索引、DMA长度或接收计数前，是否完成上下限和缓冲区容量检查？",
  "inspection_method": ["定位长度字段输入源", "追踪其数组索引、DMA长度、内存拷贝和接收计数用途", "检查首次生效前是否有统一边界校验"],
  "failure_criteria": ["外部可控长度字段未经合法范围检查即可参与内存或接收长度控制"],
  "trigger_conditions": ["协议帧包含外部可控长度字段"],
  "failure_symptoms": ["缓冲区越界", "协议状态机失步"],
  "root_cause": "信任外部长度输入，未在控制流生效边界建立约束。",
  "risk_impact": ["RAM覆盖", "协议异常", "不可预测行为"],
  "correct_practice": ["长度字段进入业务逻辑前统一做上下限校验", "非法值立即丢弃当前帧并恢复状态机"],
  "fix_recommendation": ["在长度字段首次生效位置增加边界检查"],
  "verification_method": ["覆盖0、最大合法值、最大合法值+1和类型最大值"],
  "applicable_scope": ["嵌入式通信协议"],
  "source_experience_ids": ["EXP-example"],
  "source": {"repository": "example/repo", "branch": "main", "commit": "abcdef0", "files": ["src/uart.c"]},
  "evidence_items": ["工程经验EXP-example"],
  "contributor": {"username": "example-user", "display_name": "Example User", "github_username": "example-user"},
  "submission_preferences": {"visibility": "public", "attribution": "username", "allow_repository_name": true, "allow_commit_id": true, "allow_file_paths": true, "allow_code_excerpt": false, "rights_confirmed": true},
  "privacy": {"contains_private_code": false, "sanitized": true, "notes": "示例数据"}
}
